{
  "backend": "cuda",
  "environment": {
    "cuda_runtime": "12.8",
    "cudnn": 91002,
    "device": "NVIDIA GeForce RTX 4090",
    "platform": "Linux-5.15.0-141-generic-x86_64-with-glibc2.35",
    "python": "3.12.13",
    "torch": "2.9.0+cu128"
  },
  "harness_exit_code": 0,
  "logs": [
    {
      "path": "bundle_verification.log",
      "sha256": "c3ffb9822909a80896e95005aa513a5700bef45b6d8040f1477b7a750713bbc1",
      "size_bytes": 309
    },
    {
      "path": "cache_dtype_operator_ab.log",
      "sha256": "cbf41446967597bea0aef9707cfad304a7a31a5a8def949e1d1cb38f715a2c1d",
      "size_bytes": 12595
    },
    {
      "path": "candidate_checks.log",
      "sha256": "32948767690876a2493eac685830fae72ba972a856558d4a708293a80faf96be",
      "size_bytes": 9477
    },
    {
      "path": "harness_exit_code.txt",
      "sha256": "9a271f2a916b0b6ee6cecb2426f0b3206ef074578be55d9bc94f6f3fe3ab86aa",
      "size_bytes": 2
    },
    {
      "path": "install.log",
      "sha256": "6c2dae9b076acacad771f3479f01838711bd98e7d48b429aa14b6e27438ff5ea",
      "size_bytes": 109
    },
    {
      "path": "nvidia_smi.log",
      "sha256": "5eacf2073d0f343a85143ec47b91d0426d3d602a7423fdcc2f35b3c5ffec1cd1",
      "size_bytes": 57549
    },
    {
      "path": "pip_freeze.log",
      "sha256": "730c2b5104c9f3a4fead62f4c991be334555cd8ad9fc62e99acf532779084dc1",
      "size_bytes": 890
    },
    {
      "path": "preflight.json",
      "sha256": "fc4ccfd3950887e7b1cf5cbc8d8e27ba1996a505a39544008cafaa14f95e9ff6",
      "size_bytes": 345
    },
    {
      "path": "runtime_rule_ab.log",
      "sha256": "23ba14e7d873638511334a1ef5a8a93e680d351662b7b109cd538d9b8f3e391f",
      "size_bytes": 16092
    }
  ],
  "model_execution": false,
  "model_parameters_loaded": false,
  "results": [
    {
      "path": "candidate_checks.json",
      "sha256": "3ee35a52ba3a354313c49acb3e396dac44ae10f35accaf9139c6bd691f925368",
      "size_bytes": 5870,
      "test_ids": [
        "sinusoidal_fp32_fallback",
        "eager_fixed_input",
        "compile_fixed_input",
        "sdpa_mixed_dtype_control",
        "sdpa_aligned_dtype"
      ],
      "test_statuses": [
        "passed",
        "passed",
        "passed",
        "failed",
        "passed"
      ]
    },
    {
      "path": "cache_dtype_operator_ab.json",
      "sha256": "6d1bb4049bfefce246642f27c14345b9b91b4647dec5935484e52c75a543edf4",
      "size_bytes": 12261,
      "test_ids": [
        "cache_dtype_functional_ab",
        "cache_dtype_cast_overhead_ab",
        "cache_dtype_already_aligned_control"
      ],
      "test_statuses": [
        "passed",
        "passed",
        "passed"
      ]
    },
    {
      "path": "runtime_rule_ab.json",
      "sha256": "bd3d06bc053042c04984cd7902deebe6d98e8e4476afd2c8347cf14316135f2b",
      "size_bytes": 15758,
      "test_ids": [
        "sinusoidal_fp64_functional_ab",
        "sinusoidal_fp64_performance_ab",
        "compile_capability_ab"
      ],
      "test_statuses": [
        "passed",
        "passed",
        "passed"
      ]
    }
  ],
  "schema_version": "1.0.0",
  "scope": "operator_block_ab",
  "status": "captured"
}
